Article Titles,"More than 100 companies join legal fight against Trump travel ban - Feb. 5, 2017 ","Intel CEO touts $7 billion factory investment in Trump meeting - Feb. 8, 2017 ","Elon Musk says he's 'doing good' on Trump's advisory council - Feb. 4, 2017 ","Tech industry braces for Trump's visa reform - Feb. 5, 2017 ","Facebook doubles down on bereavement leave - Feb. 7, 2017 ","Robot makes money off Trump's tweets and donates it to the ASPCA - Feb. 6, 2017 ",Jack Dorsey: 'We benefit from immigration' - Video - Tech,"'We are entrepreneurs, professors, scientists, artists' - Jan. 29, 2017 ",Crash dummies are getting 'supersized' to resemble obese drivers - Video - Tech,"State politics are the next battleground -- and tracking them just got easier - Feb. 7, 2017 ","Netflix wants in on toy and licensed merchandise business - Feb. 8, 2017 ","Sheryl Sandberg gives $1 million to Planned Parenthood - Feb. 1, 2017 ","Elon Musk hopes to bring Tesla to India 'this year' - Feb. 8, 2017 ","Twitter stock tanks 10% on disappointing sales - Feb. 9, 2017 ","How online resources are fueling the Trump resistance - Feb. 9, 2017 ","Pinterest's new 'Lens' IDs objects and helps you buy them - Feb. 8, 2017 ","Twitter tries new measures in crackdown on harassment - Feb. 7, 2017 ","Inside the quirky world of Snapchat - Feb. 3, 2017 ","Mikey Dickerson fixed Healthcare.gov. That was just the beginning - Jan. 17, 2017 ","Ooniprobe app helps people track internet censorship - Feb. 8, 2017 ","FedEx's new service takes aim at Amazon - Feb. 7, 2017 ","Microsoft unveils a new (and hopefully not racist) chat bot - Dec. 13, 2016 ","I rented a guy's $145,000 Tesla Model X - Feb. 11, 2017 ",Every order Trump has signed and what his actions mean - CNNPolitics.com,Donald Trump is doing exactly what he said - CNNPolitics.com,Live coverage: President Trump's first week - CNNPolitics.com,"Your car's data may soon be more valuable than the car itself - Feb. 7, 2017 ",Trump's talk puts GOP in a jam - CNNPolitics.com,Trump's TPP withdrawal: 5 things to know - CNNPolitics.com,Trump to move forward with voter fraud probe - CNNPolitics.com,"Andrew Puzder in 2015 discussing Trump: GOP can't be 'bigoted, anti-woman, anti-immigrant party' - CNNPolitics.com",Theresa May to visit Trump in Washington - CNN.com,Trump tells Hill GOP: Meeting Mexican president 'fruitless' - CNNPolitics.com,Obama's advice to Theresa May: Befriend Donald Trump - CNNPolitics.com,Mexican president cancels meeting with Trump - CNNPolitics.com,"Donald Trump: Torture ""absolutely works"" -- but does it? - CNNPolitics.com",A front-row seat to Trump's rise - CNNPolitics.com,Melania Trump close to announcing core staff - CNNPolitics.com,GOP congressional leaders rule out torture - CNNPolitics.com,This is not your typical 'Make America Great Again' ad - CNNPolitics.com,Dallas school district investigating clip of staff shooting water gun at Trump picture - CNNPolitics.com,Women rush to get IUDs because of Trump - CNN.com,Trump says he'll send in feds if Chicago doesn't fix 'carnage' - CNNPolitics.com,Trump floats 20% tax on Mexican imports to pay for wall - CNNPolitics.com,"Trump: 'Had we taken the oil, you wouldn't have ISIS' - CNNPolitics.com",Where Trump support and Obamacare use soar - CNN.com,Abortion laws around the globe - CNN.com,The week in politics,State Department officials asked to leave by Trump administration - CNNPolitics.com,Gina Miller: Chief Brexit claimant hopes court ruling ends abuse - CNN.com,Doomsday Clock: Humanity is edging closer to its end  - CNN.com,Trump calls Chelsea Manning 'ungrateful TRAITOR' after Obama criticism - CNNPolitics.com,Putting the 'active' in activism: How to get kids to get involved  - CNN.com,Greece won't extradite 8 Turkish military officers - CNN.com,5 reasons why some Nebraskans hate Obamacare - CNN.com,PLO on possible US Embassy move: Group will revoke Israel recognition - CNNPolitics.com,"Building Trump's wall: For Texans, it's complicated - CNNPolitics.com",What Finland's plan to be tobacco-free can teach the world - CNN.com,Quitting smoking is the hardest resolution to keep - CNN.com,The week in 29 photos,Dalai Lama's guide to the next four years - CNN.com,"Article 50: UK's path to Brexit, explained - CNN.com",Libya Fast Facts - CNN.com,15 of the world's happiest places - CNN.com,Becky Anderson on her heroes: Her fellow journalists - CNN.com,"Awaiting transplant, mom lives 6 days without lungs - CNN.com",Man uses Facebook to find woman who saved his life - CNN.com,Kids say the darndest things about being president  - CNN.com,Oil and Gasoline Fast Facts - CNN.com,Pakistan Fast Facts - CNN.com,"Washington state mumps outbreak: 278 cases, 5 counties - CNN.com",How Facebook actually isolates us  - CNN.com,Cuba Fast Facts - CNN.com,What 'Split' gets wrong about dissociative identity disorder - CNN.com,The week in 25 photos,Boxer battles for title as his father battles cancer - CNN.com,"You're more likely to catch flu after a cold snap, study says - CNN.com",China's lack of sex education is putting millions of young people at risk - CNN.com,Brexit bill introduced to parliament - CNN.com,The 6 most scientifically valid methods to quit smoking - CNN.com,"World's largest Indoor vertical farm to produce greens without sun, soil or water - CNN.com",Lebanon Fast Facts - CNN.com,US surgeons remove rare facial tumor from Brazilian girl - CNN.com,'Automated dermatologist' detects skin cancer with expert accuracy - CNN.com,Breaking the cycle of pleasure and guilt - CNN.com,Wild supercows return to Europe  - CNN.com,El Chapo Fast Facts - CNN.com,What life was like for a medieval leper - CNN.com,Can burnt toast and roasted potatoes cause cancer? - CNN.com,These twin baby girls have different skin colors  - CNN.com,Britain's navy keeps eye on Russia's 'ship of shame' - CNN.com,People we've lost in 2017,"Italy avalanche: Hotel search ends with 29 dead, 11 rescued - CNN.com",Cervical cancer death rates are much higher than thought - CNN.com,E-cigarettes: Where do we stand?  - CNN.com,11 everyday items you should stop using now ,Study: 30% of kids have two or more sugary drinks a day - CNN.com,'Fast radio burst' tracked to a dwarf galaxy 3 billion light-years away - CNN.com,South Sudan Fast Facts - CNN.com,Central African Republic Fast Facts - CNN.com
"More than 100 companies join legal fight against Trump travel ban - Feb. 5, 2017 ",1,0.591,0.58,0.571,0.555,0.513,0.513,0.5,0.474,0.467,0.466,0.457,0.45,0.438,0.43,0.429,0.401,0.397,0.392,0.386,0.382,0.369,0.345,0.33,0.314,0.31,0.305,0.277,0.273,0.267,0.234,0.227,0.225,0.224,0.222,0.211,0.208,0.202,0.195,0.194,0.176,0.166,0.159,0.158,0.153,0.15,0.149,0.147,0.146,0.146,0.144,0.13,0.124,0.123,0.115,0.115,0.114,0.104,0.104,0.1,0.1,0.099,0.098,0.095,0.089,0.089,0.088,0.088,0.085,0.085,0.084,0.083,0.082,0.08,0.08,0.079,0.079,0.077,0.073,0.073,0.072,0.07,0.067,0.066,0.065,0.065,0.064,0.062,0.06,0.058,0.054,0.053,0.05,0.046,0.045,0.042,0.037,0.036,0.031,0.019
Article Titles,Trump's TPP withdrawal: 5 things to know - CNNPolitics.com,Donald Trump is doing exactly what he said - CNNPolitics.com,Live coverage: President Trump's first week - CNNPolitics.com,Trump's talk puts GOP in a jam - CNNPolitics.com,Theresa May to visit Trump in Washington - CNN.com,Every order Trump has signed and what his actions mean - CNNPolitics.com,Trump to move forward with voter fraud probe - CNNPolitics.com,Obama's advice to Theresa May: Befriend Donald Trump - CNNPolitics.com,"Andrew Puzder in 2015 discussing Trump: GOP can't be 'bigoted, anti-woman, anti-immigrant party' - CNNPolitics.com",Mexican president cancels meeting with Trump - CNNPolitics.com,Trump tells Hill GOP: Meeting Mexican president 'fruitless' - CNNPolitics.com,Trump floats 20% tax on Mexican imports to pay for wall - CNNPolitics.com,"Donald Trump: Torture ""absolutely works"" -- but does it? - CNNPolitics.com",GOP congressional leaders rule out torture - CNNPolitics.com,"Trump: 'Had we taken the oil, you wouldn't have ISIS' - CNNPolitics.com","Robot makes money off Trump's tweets and donates it to the ASPCA - Feb. 6, 2017 ","Intel CEO touts $7 billion factory investment in Trump meeting - Feb. 8, 2017 ",Melania Trump close to announcing core staff - CNNPolitics.com,A front-row seat to Trump's rise - CNNPolitics.com,"How online resources are fueling the Trump resistance - Feb. 9, 2017 ","Elon Musk says he's 'doing good' on Trump's advisory council - Feb. 4, 2017 ",This is not your typical 'Make America Great Again' ad - CNNPolitics.com,"More than 100 companies join legal fight against Trump travel ban - Feb. 5, 2017 ",Women rush to get IUDs because of Trump - CNN.com,Abortion laws around the globe - CNN.com,Dallas school district investigating clip of staff shooting water gun at Trump picture - CNNPolitics.com,State Department officials asked to leave by Trump administration - CNNPolitics.com,Trump calls Chelsea Manning 'ungrateful TRAITOR' after Obama criticism - CNNPolitics.com,PLO on possible US Embassy move: Group will revoke Israel recognition - CNNPolitics.com,Cuba Fast Facts - CNN.com,"Twitter stock tanks 10% on disappointing sales - Feb. 9, 2017 ","Tech industry braces for Trump's visa reform - Feb. 5, 2017 ",Trump says he'll send in feds if Chicago doesn't fix 'carnage' - CNNPolitics.com,Doomsday Clock: Humanity is edging closer to its end  - CNN.com,"'We are entrepreneurs, professors, scientists, artists' - Jan. 29, 2017 ",Kids say the darndest things about being president  - CNN.com,The week in politics,"Building Trump's wall: For Texans, it's complicated - CNNPolitics.com",Oil and Gasoline Fast Facts - CNN.com,Putting the 'active' in activism: How to get kids to get involved  - CNN.com,"State politics are the next battleground -- and tracking them just got easier - Feb. 7, 2017 ","Article 50: UK's path to Brexit, explained - CNN.com","Sheryl Sandberg gives $1 million to Planned Parenthood - Feb. 1, 2017 ",Jack Dorsey: 'We benefit from immigration' - Video - Tech,Becky Anderson on her heroes: Her fellow journalists - CNN.com,"Mikey Dickerson fixed Healthcare.gov. That was just the beginning - Jan. 17, 2017 ",Where Trump support and Obamacare use soar - CNN.com,What Finland's plan to be tobacco-free can teach the world - CNN.com,US surgeons remove rare facial tumor from Brazilian girl - CNN.com,China's lack of sex education is putting millions of young people at risk - CNN.com,5 reasons why some Nebraskans hate Obamacare - CNN.com,Greece won't extradite 8 Turkish military officers - CNN.com,Dalai Lama's guide to the next four years - CNN.com,Crash dummies are getting 'supersized' to resemble obese drivers - Video - Tech,How Facebook actually isolates us  - CNN.com,The week in 29 photos,"FedEx's new service takes aim at Amazon - Feb. 7, 2017 ",Brexit bill introduced to parliament - CNN.com,"Facebook doubles down on bereavement leave - Feb. 7, 2017 ","Awaiting transplant, mom lives 6 days without lungs - CNN.com",Quitting smoking is the hardest resolution to keep - CNN.com,Man uses Facebook to find woman who saved his life - CNN.com,"Elon Musk hopes to bring Tesla to India 'this year' - Feb. 8, 2017 ",Gina Miller: Chief Brexit claimant hopes court ruling ends abuse - CNN.com,"Inside the quirky world of Snapchat - Feb. 3, 2017 ",15 of the world's happiest places - CNN.com,Libya Fast Facts - CNN.com,"Netflix wants in on toy and licensed merchandise business - Feb. 8, 2017 ","Twitter tries new measures in crackdown on harassment - Feb. 7, 2017 ","Ooniprobe app helps people track internet censorship - Feb. 8, 2017 ","Pinterest's new 'Lens' IDs objects and helps you buy them - Feb. 8, 2017 ",El Chapo Fast Facts - CNN.com,"You're more likely to catch flu after a cold snap, study says - CNN.com",What 'Split' gets wrong about dissociative identity disorder - CNN.com,"I rented a guy's $145,000 Tesla Model X - Feb. 11, 2017 ","Washington state mumps outbreak: 278 cases, 5 counties - CNN.com",The week in 25 photos,Boxer battles for title as his father battles cancer - CNN.com,'Automated dermatologist' detects skin cancer with expert accuracy - CNN.com,"Microsoft unveils a new (and hopefully not racist) chat bot - Dec. 13, 2016 ",Britain's navy keeps eye on Russia's 'ship of shame' - CNN.com,These twin baby girls have different skin colors  - CNN.com,What life was like for a medieval leper - CNN.com,"Your car's data may soon be more valuable than the car itself - Feb. 7, 2017 ",Cervical cancer death rates are much higher than thought - CNN.com,The 6 most scientifically valid methods to quit smoking - CNN.com,Breaking the cycle of pleasure and guilt - CNN.com,Can burnt toast and roasted potatoes cause cancer? - CNN.com,"World's largest Indoor vertical farm to produce greens without sun, soil or water - CNN.com",Pakistan Fast Facts - CNN.com,Wild supercows return to Europe  - CNN.com,Lebanon Fast Facts - CNN.com,"Italy avalanche: Hotel search ends with 29 dead, 11 rescued - CNN.com",E-cigarettes: Where do we stand?  - CNN.com,'Fast radio burst' tracked to a dwarf galaxy 3 billion light-years away - CNN.com,People we've lost in 2017,11 everyday items you should stop using now ,South Sudan Fast Facts - CNN.com,Study: 30% of kids have two or more sugary drinks a day - CNN.com,Central African Republic Fast Facts - CNN.com
Trump's TPP withdrawal: 5 things to know - CNNPolitics.com,1,0.46,0.424,0.411,0.4,0.393,0.382,0.374,0.347,0.347,0.323,0.311,0.309,0.3,0.294,0.291,0.288,0.288,0.285,0.285,0.283,0.279,0.273,0.257,0.251,0.251,0.243,0.242,0.236,0.232,0.229,0.22,0.218,0.212,0.21,0.206,0.204,0.194,0.193,0.191,0.187,0.183,0.18,0.17,0.165,0.165,0.164,0.162,0.158,0.155,0.154,0.153,0.151,0.144,0.143,0.142,0.142,0.14,0.14,0.14,0.139,0.137,0.132,0.132,0.13,0.129,0.128,0.127,0.125,0.123,0.122,0.12,0.12,0.118,0.118,0.115,0.114,0.113,0.113,0.109,0.109,0.107,0.106,0.105,0.103,0.103,0.098,0.096,0.094,0.093,0.091,0.082,0.068,0.06,0.056,0.056,0.055,0.054,0.052,0.025
Article Titles,Becky Anderson on her heroes: Her fellow journalists - CNN.com,Abortion laws around the globe - CNN.com,These twin baby girls have different skin colors  - CNN.com,How Facebook actually isolates us  - CNN.com,Doomsday Clock: Humanity is edging closer to its end  - CNN.com,Man uses Facebook to find woman who saved his life - CNN.com,Brexit bill introduced to parliament - CNN.com,Boxer battles for title as his father battles cancer - CNN.com,Gina Miller: Chief Brexit claimant hopes court ruling ends abuse - CNN.com,"Article 50: UK's path to Brexit, explained - CNN.com",US surgeons remove rare facial tumor from Brazilian girl - CNN.com,Theresa May to visit Trump in Washington - CNN.com,"You're more likely to catch flu after a cold snap, study says - CNN.com",Greece won't extradite 8 Turkish military officers - CNN.com,GOP congressional leaders rule out torture - CNNPolitics.com,Britain's navy keeps eye on Russia's 'ship of shame' - CNN.com,Women rush to get IUDs because of Trump - CNN.com,Oil and Gasoline Fast Facts - CNN.com,Putting the 'active' in activism: How to get kids to get involved  - CNN.com,People we've lost in 2017,This is not your typical 'Make America Great Again' ad - CNNPolitics.com,Live coverage: President Trump's first week - CNNPolitics.com,Dalai Lama's guide to the next four years - CNN.com,El Chapo Fast Facts - CNN.com,Quitting smoking is the hardest resolution to keep - CNN.com,What life was like for a medieval leper - CNN.com,"World's largest Indoor vertical farm to produce greens without sun, soil or water - CNN.com",5 reasons why some Nebraskans hate Obamacare - CNN.com,Kids say the darndest things about being president  - CNN.com,China's lack of sex education is putting millions of young people at risk - CNN.com,"Washington state mumps outbreak: 278 cases, 5 counties - CNN.com",'Automated dermatologist' detects skin cancer with expert accuracy - CNN.com,15 of the world's happiest places - CNN.com,Breaking the cycle of pleasure and guilt - CNN.com,Wild supercows return to Europe  - CNN.com,What Finland's plan to be tobacco-free can teach the world - CNN.com,"Awaiting transplant, mom lives 6 days without lungs - CNN.com",Can burnt toast and roasted potatoes cause cancer? - CNN.com,11 everyday items you should stop using now ,Melania Trump close to announcing core staff - CNNPolitics.com,Dallas school district investigating clip of staff shooting water gun at Trump picture - CNNPolitics.com,Obama's advice to Theresa May: Befriend Donald Trump - CNNPolitics.com,The 6 most scientifically valid methods to quit smoking - CNN.com,"Italy avalanche: Hotel search ends with 29 dead, 11 rescued - CNN.com","Trump: 'Had we taken the oil, you wouldn't have ISIS' - CNNPolitics.com",PLO on possible US Embassy move: Group will revoke Israel recognition - CNNPolitics.com,Lebanon Fast Facts - CNN.com,Trump to move forward with voter fraud probe - CNNPolitics.com,Cervical cancer death rates are much higher than thought - CNN.com,Donald Trump is doing exactly what he said - CNNPolitics.com,What 'Split' gets wrong about dissociative identity disorder - CNN.com,Pakistan Fast Facts - CNN.com,"Andrew Puzder in 2015 discussing Trump: GOP can't be 'bigoted, anti-woman, anti-immigrant party' - CNNPolitics.com",State Department officials asked to leave by Trump administration - CNNPolitics.com,Trump calls Chelsea Manning 'ungrateful TRAITOR' after Obama criticism - CNNPolitics.com,Where Trump support and Obamacare use soar - CNN.com,Libya Fast Facts - CNN.com,Trump says he'll send in feds if Chicago doesn't fix 'carnage' - CNNPolitics.com,The week in 25 photos,Trump's talk puts GOP in a jam - CNNPolitics.com,"Donald Trump: Torture ""absolutely works"" -- but does it? - CNNPolitics.com",A front-row seat to Trump's rise - CNNPolitics.com,Cuba Fast Facts - CNN.com,Trump's TPP withdrawal: 5 things to know - CNNPolitics.com,The week in 29 photos,Mexican president cancels meeting with Trump - CNNPolitics.com,Trump floats 20% tax on Mexican imports to pay for wall - CNNPolitics.com,"Mikey Dickerson fixed Healthcare.gov. That was just the beginning - Jan. 17, 2017 ",Jack Dorsey: 'We benefit from immigration' - Video - Tech,"Inside the quirky world of Snapchat - Feb. 3, 2017 ","State politics are the next battleground -- and tracking them just got easier - Feb. 7, 2017 ","Pinterest's new 'Lens' IDs objects and helps you buy them - Feb. 8, 2017 ",Crash dummies are getting 'supersized' to resemble obese drivers - Video - Tech,"Ooniprobe app helps people track internet censorship - Feb. 8, 2017 ",'Fast radio burst' tracked to a dwarf galaxy 3 billion light-years away - CNN.com,"Facebook doubles down on bereavement leave - Feb. 7, 2017 ","Netflix wants in on toy and licensed merchandise business - Feb. 8, 2017 ","Intel CEO touts $7 billion factory investment in Trump meeting - Feb. 8, 2017 ","'We are entrepreneurs, professors, scientists, artists' - Jan. 29, 2017 ","Twitter stock tanks 10% on disappointing sales - Feb. 9, 2017 ",Every order Trump has signed and what his actions mean - CNNPolitics.com,"Elon Musk hopes to bring Tesla to India 'this year' - Feb. 8, 2017 ","Twitter tries new measures in crackdown on harassment - Feb. 7, 2017 ","How online resources are fueling the Trump resistance - Feb. 9, 2017 ",Study: 30% of kids have two or more sugary drinks a day - CNN.com,E-cigarettes: Where do we stand?  - CNN.com,"Robot makes money off Trump's tweets and donates it to the ASPCA - Feb. 6, 2017 ","Sheryl Sandberg gives $1 million to Planned Parenthood - Feb. 1, 2017 ","Tech industry braces for Trump's visa reform - Feb. 5, 2017 ","Microsoft unveils a new (and hopefully not racist) chat bot - Dec. 13, 2016 ","Elon Musk says he's 'doing good' on Trump's advisory council - Feb. 4, 2017 ",The week in politics,"More than 100 companies join legal fight against Trump travel ban - Feb. 5, 2017 ",Trump tells Hill GOP: Meeting Mexican president 'fruitless' - CNNPolitics.com,"FedEx's new service takes aim at Amazon - Feb. 7, 2017 ","I rented a guy's $145,000 Tesla Model X - Feb. 11, 2017 ","Building Trump's wall: For Texans, it's complicated - CNNPolitics.com","Your car's data may soon be more valuable than the car itself - Feb. 7, 2017 ",South Sudan Fast Facts - CNN.com,Central African Republic Fast Facts - CNN.com
Becky Anderson on her heroes: Her fellow journalists - CNN.com,1,0.55,0.503,0.486,0.48,0.463,0.453,0.426,0.415,0.395,0.393,0.391,0.391,0.385,0.367,0.362,0.361,0.353,0.349,0.345,0.343,0.338,0.33,0.328,0.31,0.308,0.305,0.304,0.303,0.301,0.296,0.279,0.276,0.268,0.268,0.267,0.267,0.262,0.261,0.26,0.259,0.258,0.249,0.244,0.238,0.228,0.217,0.216,0.212,0.212,0.211,0.2,0.198,0.186,0.185,0.184,0.183,0.179,0.176,0.173,0.168,0.168,0.167,0.165,0.163,0.142,0.138,0.134,0.124,0.124,0.123,0.121,0.121,0.121,0.117,0.117,0.116,0.113,0.113,0.112,0.11,0.108,0.108,0.108,0.107,0.107,0.105,0.104,0.101,0.098,0.096,0.09,0.089,0.088,0.086,0.084,0.083,0.072,0.059,0.036
