Article Titles,"Microsoft unveils a new (and hopefully not racist) chat bot - Dec. 13, 2016 ","Robot makes money off Trump's tweets and donates it to the ASPCA - Feb. 6, 2017 ","Netflix wants in on toy and licensed merchandise business - Feb. 8, 2017 ",Jack Dorsey: 'We benefit from immigration' - Video - Tech,"Facebook doubles down on bereavement leave - Feb. 7, 2017 ","Pinterest's new 'Lens' IDs objects and helps you buy them - Feb. 8, 2017 ","'We are entrepreneurs, professors, scientists, artists' - Jan. 29, 2017 ",Crash dummies are getting 'supersized' to resemble obese drivers - Video - Tech,"Twitter tries new measures in crackdown on harassment - Feb. 7, 2017 ","Inside the quirky world of Snapchat - Feb. 3, 2017 ","Elon Musk hopes to bring Tesla to India 'this year' - Feb. 8, 2017 ","Ooniprobe app helps people track internet censorship - Feb. 8, 2017 ","State politics are the next battleground -- and tracking them just got easier - Feb. 7, 2017 ","Sheryl Sandberg gives $1 million to Planned Parenthood - Feb. 1, 2017 ","Twitter stock tanks 10% on disappointing sales - Feb. 9, 2017 ","Intel CEO touts $7 billion factory investment in Trump meeting - Feb. 8, 2017 ","Mikey Dickerson fixed Healthcare.gov. That was just the beginning - Jan. 17, 2017 ","I rented a guy's $145,000 Tesla Model X - Feb. 11, 2017 ","Tech industry braces for Trump's visa reform - Feb. 5, 2017 ","FedEx's new service takes aim at Amazon - Feb. 7, 2017 ","More than 100 companies join legal fight against Trump travel ban - Feb. 5, 2017 ","How online resources are fueling the Trump resistance - Feb. 9, 2017 ","Elon Musk says he's 'doing good' on Trump's advisory council - Feb. 4, 2017 ","Your car's data may soon be more valuable than the car itself - Feb. 7, 2017 ",Quitting smoking is the hardest resolution to keep - CNN.com,This is not your typical 'Make America Great Again' ad - CNNPolitics.com,GOP congressional leaders rule out torture - CNNPolitics.com,Putting the 'active' in activism: How to get kids to get involved  - CNN.com,Where Trump support and Obamacare use soar - CNN.com,Live coverage: President Trump's first week - CNNPolitics.com,Donald Trump is doing exactly what he said - CNNPolitics.com,Dalai Lama's guide to the next four years - CNN.com,China's lack of sex education is putting millions of young people at risk - CNN.com,Man uses Facebook to find woman who saved his life - CNN.com,Melania Trump close to announcing core staff - CNNPolitics.com,Theresa May to visit Trump in Washington - CNN.com,Women rush to get IUDs because of Trump - CNN.com,State Department officials asked to leave by Trump administration - CNNPolitics.com,Dallas school district investigating clip of staff shooting water gun at Trump picture - CNNPolitics.com,What Finland's plan to be tobacco-free can teach the world - CNN.com,Trump says he'll send in feds if Chicago doesn't fix 'carnage' - CNNPolitics.com,Obama's advice to Theresa May: Befriend Donald Trump - CNNPolitics.com,"Trump: 'Had we taken the oil, you wouldn't have ISIS' - CNNPolitics.com",Trump's talk puts GOP in a jam - CNNPolitics.com,"Andrew Puzder in 2015 discussing Trump: GOP can't be 'bigoted, anti-woman, anti-immigrant party' - CNNPolitics.com",Trump to move forward with voter fraud probe - CNNPolitics.com,The 6 most scientifically valid methods to quit smoking - CNN.com,What 'Split' gets wrong about dissociative identity disorder - CNN.com,Kids say the darndest things about being president  - CNN.com,Trump's TPP withdrawal: 5 things to know - CNNPolitics.com,How Facebook actually isolates us  - CNN.com,5 reasons why some Nebraskans hate Obamacare - CNN.com,"Washington state mumps outbreak: 278 cases, 5 counties - CNN.com",Abortion laws around the globe - CNN.com,Mexican president cancels meeting with Trump - CNNPolitics.com,A front-row seat to Trump's rise - CNNPolitics.com,Becky Anderson on her heroes: Her fellow journalists - CNN.com,15 of the world's happiest places - CNN.com,"You're more likely to catch flu after a cold snap, study says - CNN.com","Donald Trump: Torture ""absolutely works"" -- but does it? - CNNPolitics.com",Trump floats 20% tax on Mexican imports to pay for wall - CNNPolitics.com,Doomsday Clock: Humanity is edging closer to its end  - CNN.com,Breaking the cycle of pleasure and guilt - CNN.com,Every order Trump has signed and what his actions mean - CNNPolitics.com,US surgeons remove rare facial tumor from Brazilian girl - CNN.com,"Awaiting transplant, mom lives 6 days without lungs - CNN.com",Greece won't extradite 8 Turkish military officers - CNN.com,'Automated dermatologist' detects skin cancer with expert accuracy - CNN.com,These twin baby girls have different skin colors  - CNN.com,PLO on possible US Embassy move: Group will revoke Israel recognition - CNNPolitics.com,People we've lost in 2017,"World's largest Indoor vertical farm to produce greens without sun, soil or water - CNN.com",Gina Miller: Chief Brexit claimant hopes court ruling ends abuse - CNN.com,What life was like for a medieval leper - CNN.com,Trump calls Chelsea Manning 'ungrateful TRAITOR' after Obama criticism - CNNPolitics.com,Can burnt toast and roasted potatoes cause cancer? - CNN.com,Brexit bill introduced to parliament - CNN.com,"Article 50: UK's path to Brexit, explained - CNN.com",Boxer battles for title as his father battles cancer - CNN.com,"Building Trump's wall: For Texans, it's complicated - CNNPolitics.com",Britain's navy keeps eye on Russia's 'ship of shame' - CNN.com,Oil and Gasoline Fast Facts - CNN.com,El Chapo Fast Facts - CNN.com,The week in politics,Pakistan Fast Facts - CNN.com,Wild supercows return to Europe  - CNN.com,E-cigarettes: Where do we stand?  - CNN.com,Trump tells Hill GOP: Meeting Mexican president 'fruitless' - CNNPolitics.com,Cuba Fast Facts - CNN.com,"Italy avalanche: Hotel search ends with 29 dead, 11 rescued - CNN.com",11 everyday items you should stop using now ,Cervical cancer death rates are much higher than thought - CNN.com,Libya Fast Facts - CNN.com,The week in 29 photos,Lebanon Fast Facts - CNN.com,The week in 25 photos,Study: 30% of kids have two or more sugary drinks a day - CNN.com,'Fast radio burst' tracked to a dwarf galaxy 3 billion light-years away - CNN.com,South Sudan Fast Facts - CNN.com,Central African Republic Fast Facts - CNN.com
"Microsoft unveils a new (and hopefully not racist) chat bot - Dec. 13, 2016 ",1,0.493,0.492,0.475,0.475,0.474,0.47,0.467,0.46,0.448,0.447,0.438,0.437,0.416,0.413,0.404,0.394,0.375,0.374,0.374,0.369,0.365,0.364,0.308,0.162,0.157,0.147,0.146,0.146,0.142,0.138,0.134,0.134,0.129,0.128,0.126,0.124,0.124,0.12,0.119,0.118,0.118,0.117,0.116,0.116,0.116,0.113,0.112,0.111,0.109,0.107,0.107,0.107,0.101,0.1,0.098,0.098,0.098,0.098,0.097,0.097,0.097,0.096,0.095,0.095,0.095,0.094,0.091,0.089,0.089,0.087,0.086,0.085,0.084,0.081,0.08,0.077,0.077,0.076,0.075,0.073,0.068,0.068,0.065,0.064,0.062,0.062,0.056,0.055,0.055,0.054,0.053,0.051,0.051,0.051,0.046,0.044,0.043,0.032,0.023
Article Titles,Crash dummies are getting 'supersized' to resemble obese drivers - Video - Tech,Jack Dorsey: 'We benefit from immigration' - Video - Tech,"Netflix wants in on toy and licensed merchandise business - Feb. 8, 2017 ","Facebook doubles down on bereavement leave - Feb. 7, 2017 ","'We are entrepreneurs, professors, scientists, artists' - Jan. 29, 2017 ","Pinterest's new 'Lens' IDs objects and helps you buy them - Feb. 8, 2017 ","Elon Musk hopes to bring Tesla to India 'this year' - Feb. 8, 2017 ","Inside the quirky world of Snapchat - Feb. 3, 2017 ","Robot makes money off Trump's tweets and donates it to the ASPCA - Feb. 6, 2017 ","State politics are the next battleground -- and tracking them just got easier - Feb. 7, 2017 ","Intel CEO touts $7 billion factory investment in Trump meeting - Feb. 8, 2017 ","Sheryl Sandberg gives $1 million to Planned Parenthood - Feb. 1, 2017 ","Twitter tries new measures in crackdown on harassment - Feb. 7, 2017 ","FedEx's new service takes aim at Amazon - Feb. 7, 2017 ","Ooniprobe app helps people track internet censorship - Feb. 8, 2017 ","Tech industry braces for Trump's visa reform - Feb. 5, 2017 ","More than 100 companies join legal fight against Trump travel ban - Feb. 5, 2017 ","Microsoft unveils a new (and hopefully not racist) chat bot - Dec. 13, 2016 ","Elon Musk says he's 'doing good' on Trump's advisory council - Feb. 4, 2017 ","Mikey Dickerson fixed Healthcare.gov. That was just the beginning - Jan. 17, 2017 ","Twitter stock tanks 10% on disappointing sales - Feb. 9, 2017 ","I rented a guy's $145,000 Tesla Model X - Feb. 11, 2017 ","How online resources are fueling the Trump resistance - Feb. 9, 2017 ","Your car's data may soon be more valuable than the car itself - Feb. 7, 2017 ",Live coverage: President Trump's first week - CNNPolitics.com,GOP congressional leaders rule out torture - CNNPolitics.com,This is not your typical 'Make America Great Again' ad - CNNPolitics.com,Donald Trump is doing exactly what he said - CNNPolitics.com,Dallas school district investigating clip of staff shooting water gun at Trump picture - CNNPolitics.com,Melania Trump close to announcing core staff - CNNPolitics.com,Trump says he'll send in feds if Chicago doesn't fix 'carnage' - CNNPolitics.com,Obama's advice to Theresa May: Befriend Donald Trump - CNNPolitics.com,"Andrew Puzder in 2015 discussing Trump: GOP can't be 'bigoted, anti-woman, anti-immigrant party' - CNNPolitics.com",Trump's TPP withdrawal: 5 things to know - CNNPolitics.com,Theresa May to visit Trump in Washington - CNN.com,Trump to move forward with voter fraud probe - CNNPolitics.com,Trump's talk puts GOP in a jam - CNNPolitics.com,"Trump: 'Had we taken the oil, you wouldn't have ISIS' - CNNPolitics.com",State Department officials asked to leave by Trump administration - CNNPolitics.com,Doomsday Clock: Humanity is edging closer to its end  - CNN.com,Mexican president cancels meeting with Trump - CNNPolitics.com,Becky Anderson on her heroes: Her fellow journalists - CNN.com,Abortion laws around the globe - CNN.com,Every order Trump has signed and what his actions mean - CNNPolitics.com,How Facebook actually isolates us  - CNN.com,A front-row seat to Trump's rise - CNNPolitics.com,PLO on possible US Embassy move: Group will revoke Israel recognition - CNNPolitics.com,Trump floats 20% tax on Mexican imports to pay for wall - CNNPolitics.com,"Donald Trump: Torture ""absolutely works"" -- but does it? - CNNPolitics.com",Women rush to get IUDs because of Trump - CNN.com,Trump calls Chelsea Manning 'ungrateful TRAITOR' after Obama criticism - CNNPolitics.com,Man uses Facebook to find woman who saved his life - CNN.com,Putting the 'active' in activism: How to get kids to get involved  - CNN.com,Boxer battles for title as his father battles cancer - CNN.com,Trump tells Hill GOP: Meeting Mexican president 'fruitless' - CNNPolitics.com,These twin baby girls have different skin colors  - CNN.com,5 reasons why some Nebraskans hate Obamacare - CNN.com,"You're more likely to catch flu after a cold snap, study says - CNN.com",15 of the world's happiest places - CNN.com,Oil and Gasoline Fast Facts - CNN.com,"World's largest Indoor vertical farm to produce greens without sun, soil or water - CNN.com",Breaking the cycle of pleasure and guilt - CNN.com,Dalai Lama's guide to the next four years - CNN.com,Where Trump support and Obamacare use soar - CNN.com,US surgeons remove rare facial tumor from Brazilian girl - CNN.com,Gina Miller: Chief Brexit claimant hopes court ruling ends abuse - CNN.com,China's lack of sex education is putting millions of young people at risk - CNN.com,"Article 50: UK's path to Brexit, explained - CNN.com",Greece won't extradite 8 Turkish military officers - CNN.com,Brexit bill introduced to parliament - CNN.com,Can burnt toast and roasted potatoes cause cancer? - CNN.com,'Automated dermatologist' detects skin cancer with expert accuracy - CNN.com,What Finland's plan to be tobacco-free can teach the world - CNN.com,Kids say the darndest things about being president  - CNN.com,Quitting smoking is the hardest resolution to keep - CNN.com,Cervical cancer death rates are much higher than thought - CNN.com,What life was like for a medieval leper - CNN.com,The week in politics,"Awaiting transplant, mom lives 6 days without lungs - CNN.com",El Chapo Fast Facts - CNN.com,Britain's navy keeps eye on Russia's 'ship of shame' - CNN.com,The 6 most scientifically valid methods to quit smoking - CNN.com,"Building Trump's wall: For Texans, it's complicated - CNNPolitics.com","Washington state mumps outbreak: 278 cases, 5 counties - CNN.com",Wild supercows return to Europe  - CNN.com,"Italy avalanche: Hotel search ends with 29 dead, 11 rescued - CNN.com",The week in 29 photos,11 everyday items you should stop using now ,What 'Split' gets wrong about dissociative identity disorder - CNN.com,E-cigarettes: Where do we stand?  - CNN.com,Cuba Fast Facts - CNN.com,People we've lost in 2017,Lebanon Fast Facts - CNN.com,Pakistan Fast Facts - CNN.com,Libya Fast Facts - CNN.com,The week in 25 photos,'Fast radio burst' tracked to a dwarf galaxy 3 billion light-years away - CNN.com,Study: 30% of kids have two or more sugary drinks a day - CNN.com,South Sudan Fast Facts - CNN.com,Central African Republic Fast Facts - CNN.com
Crash dummies are getting 'supersized' to resemble obese drivers - Video - Tech,1,0.899,0.633,0.597,0.578,0.561,0.547,0.544,0.531,0.529,0.528,0.522,0.503,0.501,0.5,0.489,0.474,0.467,0.466,0.466,0.44,0.433,0.384,0.376,0.207,0.178,0.171,0.164,0.157,0.155,0.151,0.15,0.147,0.144,0.143,0.142,0.133,0.128,0.127,0.125,0.125,0.121,0.119,0.114,0.112,0.111,0.107,0.106,0.105,0.101,0.095,0.095,0.09,0.09,0.089,0.086,0.084,0.083,0.082,0.081,0.081,0.08,0.08,0.079,0.078,0.078,0.076,0.075,0.075,0.074,0.074,0.072,0.069,0.069,0.069,0.068,0.068,0.068,0.068,0.066,0.065,0.063,0.062,0.061,0.06,0.052,0.049,0.048,0.048,0.048,0.047,0.047,0.046,0.044,0.04,0.037,0.036,0.035,0.015,0.008
Article Titles,"Elon Musk hopes to bring Tesla to India 'this year' - Feb. 8, 2017 ","Netflix wants in on toy and licensed merchandise business - Feb. 8, 2017 ","Elon Musk says he's 'doing good' on Trump's advisory council - Feb. 4, 2017 ",Jack Dorsey: 'We benefit from immigration' - Video - Tech,Crash dummies are getting 'supersized' to resemble obese drivers - Video - Tech,"Facebook doubles down on bereavement leave - Feb. 7, 2017 ","Pinterest's new 'Lens' IDs objects and helps you buy them - Feb. 8, 2017 ","'We are entrepreneurs, professors, scientists, artists' - Jan. 29, 2017 ","Inside the quirky world of Snapchat - Feb. 3, 2017 ","Robot makes money off Trump's tweets and donates it to the ASPCA - Feb. 6, 2017 ","Twitter tries new measures in crackdown on harassment - Feb. 7, 2017 ","State politics are the next battleground -- and tracking them just got easier - Feb. 7, 2017 ","Sheryl Sandberg gives $1 million to Planned Parenthood - Feb. 1, 2017 ","Intel CEO touts $7 billion factory investment in Trump meeting - Feb. 8, 2017 ","I rented a guy's $145,000 Tesla Model X - Feb. 11, 2017 ","Ooniprobe app helps people track internet censorship - Feb. 8, 2017 ","FedEx's new service takes aim at Amazon - Feb. 7, 2017 ","More than 100 companies join legal fight against Trump travel ban - Feb. 5, 2017 ","Mikey Dickerson fixed Healthcare.gov. That was just the beginning - Jan. 17, 2017 ","Microsoft unveils a new (and hopefully not racist) chat bot - Dec. 13, 2016 ","Twitter stock tanks 10% on disappointing sales - Feb. 9, 2017 ","Tech industry braces for Trump's visa reform - Feb. 5, 2017 ","Your car's data may soon be more valuable than the car itself - Feb. 7, 2017 ","How online resources are fueling the Trump resistance - Feb. 9, 2017 ",This is not your typical 'Make America Great Again' ad - CNNPolitics.com,GOP congressional leaders rule out torture - CNNPolitics.com,Live coverage: President Trump's first week - CNNPolitics.com,Theresa May to visit Trump in Washington - CNN.com,Donald Trump is doing exactly what he said - CNNPolitics.com,Melania Trump close to announcing core staff - CNNPolitics.com,Dallas school district investigating clip of staff shooting water gun at Trump picture - CNNPolitics.com,Quitting smoking is the hardest resolution to keep - CNN.com,Putting the 'active' in activism: How to get kids to get involved  - CNN.com,Trump says he'll send in feds if Chicago doesn't fix 'carnage' - CNNPolitics.com,Trump to move forward with voter fraud probe - CNNPolitics.com,Where Trump support and Obamacare use soar - CNN.com,Trump's TPP withdrawal: 5 things to know - CNNPolitics.com,Obama's advice to Theresa May: Befriend Donald Trump - CNNPolitics.com,Doomsday Clock: Humanity is edging closer to its end  - CNN.com,What Finland's plan to be tobacco-free can teach the world - CNN.com,Every order Trump has signed and what his actions mean - CNNPolitics.com,Trump floats 20% tax on Mexican imports to pay for wall - CNNPolitics.com,Women rush to get IUDs because of Trump - CNN.com,"Andrew Puzder in 2015 discussing Trump: GOP can't be 'bigoted, anti-woman, anti-immigrant party' - CNNPolitics.com",5 reasons why some Nebraskans hate Obamacare - CNN.com,PLO on possible US Embassy move: Group will revoke Israel recognition - CNNPolitics.com,State Department officials asked to leave by Trump administration - CNNPolitics.com,"Trump: 'Had we taken the oil, you wouldn't have ISIS' - CNNPolitics.com",Mexican president cancels meeting with Trump - CNNPolitics.com,Trump's talk puts GOP in a jam - CNNPolitics.com,Man uses Facebook to find woman who saved his life - CNN.com,Dalai Lama's guide to the next four years - CNN.com,Abortion laws around the globe - CNN.com,Becky Anderson on her heroes: Her fellow journalists - CNN.com,Greece won't extradite 8 Turkish military officers - CNN.com,"Article 50: UK's path to Brexit, explained - CNN.com",Kids say the darndest things about being president  - CNN.com,"Donald Trump: Torture ""absolutely works"" -- but does it? - CNNPolitics.com",How Facebook actually isolates us  - CNN.com,Brexit bill introduced to parliament - CNN.com,A front-row seat to Trump's rise - CNNPolitics.com,What life was like for a medieval leper - CNN.com,"World's largest Indoor vertical farm to produce greens without sun, soil or water - CNN.com",US surgeons remove rare facial tumor from Brazilian girl - CNN.com,15 of the world's happiest places - CNN.com,"You're more likely to catch flu after a cold snap, study says - CNN.com",The 6 most scientifically valid methods to quit smoking - CNN.com,"Awaiting transplant, mom lives 6 days without lungs - CNN.com",Gina Miller: Chief Brexit claimant hopes court ruling ends abuse - CNN.com,Breaking the cycle of pleasure and guilt - CNN.com,"Washington state mumps outbreak: 278 cases, 5 counties - CNN.com",Trump calls Chelsea Manning 'ungrateful TRAITOR' after Obama criticism - CNNPolitics.com,China's lack of sex education is putting millions of young people at risk - CNN.com,Oil and Gasoline Fast Facts - CNN.com,Boxer battles for title as his father battles cancer - CNN.com,'Automated dermatologist' detects skin cancer with expert accuracy - CNN.com,These twin baby girls have different skin colors  - CNN.com,What 'Split' gets wrong about dissociative identity disorder - CNN.com,Pakistan Fast Facts - CNN.com,Can burnt toast and roasted potatoes cause cancer? - CNN.com,"Building Trump's wall: For Texans, it's complicated - CNNPolitics.com",Wild supercows return to Europe  - CNN.com,Britain's navy keeps eye on Russia's 'ship of shame' - CNN.com,11 everyday items you should stop using now ,Cuba Fast Facts - CNN.com,El Chapo Fast Facts - CNN.com,The week in politics,Trump tells Hill GOP: Meeting Mexican president 'fruitless' - CNNPolitics.com,E-cigarettes: Where do we stand?  - CNN.com,Libya Fast Facts - CNN.com,Lebanon Fast Facts - CNN.com,"Italy avalanche: Hotel search ends with 29 dead, 11 rescued - CNN.com",Cervical cancer death rates are much higher than thought - CNN.com,People we've lost in 2017,The week in 29 photos,'Fast radio burst' tracked to a dwarf galaxy 3 billion light-years away - CNN.com,South Sudan Fast Facts - CNN.com,The week in 25 photos,Study: 30% of kids have two or more sugary drinks a day - CNN.com,Central African Republic Fast Facts - CNN.com
"Elon Musk hopes to bring Tesla to India 'this year' - Feb. 8, 2017 ",1,0.57,0.563,0.552,0.547,0.545,0.526,0.526,0.525,0.495,0.49,0.484,0.474,0.472,0.472,0.47,0.451,0.45,0.449,0.447,0.443,0.432,0.395,0.374,0.18,0.164,0.162,0.154,0.153,0.146,0.146,0.144,0.142,0.137,0.137,0.134,0.132,0.132,0.131,0.128,0.128,0.125,0.124,0.124,0.123,0.122,0.122,0.121,0.118,0.117,0.116,0.112,0.111,0.108,0.107,0.106,0.106,0.105,0.105,0.101,0.099,0.097,0.097,0.096,0.096,0.096,0.095,0.095,0.092,0.089,0.089,0.088,0.086,0.085,0.084,0.08,0.078,0.078,0.078,0.077,0.076,0.075,0.071,0.071,0.07,0.07,0.068,0.064,0.064,0.062,0.062,0.057,0.052,0.052,0.048,0.046,0.043,0.041,0.038,0.014
