Article Titles,"FedEx's new service takes aim at Amazon - Feb. 7, 2017 ","Netflix wants in on toy and licensed merchandise business - Feb. 8, 2017 ",Jack Dorsey: 'We benefit from immigration' - Video - Tech,Crash dummies are getting 'supersized' to resemble obese drivers - Video - Tech,"Facebook doubles down on bereavement leave - Feb. 7, 2017 ","Pinterest's new 'Lens' IDs objects and helps you buy them - Feb. 8, 2017 ","'We are entrepreneurs, professors, scientists, artists' - Jan. 29, 2017 ","Elon Musk hopes to bring Tesla to India 'this year' - Feb. 8, 2017 ","Inside the quirky world of Snapchat - Feb. 3, 2017 ","Intel CEO touts $7 billion factory investment in Trump meeting - Feb. 8, 2017 ","Robot makes money off Trump's tweets and donates it to the ASPCA - Feb. 6, 2017 ","State politics are the next battleground -- and tracking them just got easier - Feb. 7, 2017 ","Sheryl Sandberg gives $1 million to Planned Parenthood - Feb. 1, 2017 ","Twitter tries new measures in crackdown on harassment - Feb. 7, 2017 ","Ooniprobe app helps people track internet censorship - Feb. 8, 2017 ","Mikey Dickerson fixed Healthcare.gov. That was just the beginning - Jan. 17, 2017 ","More than 100 companies join legal fight against Trump travel ban - Feb. 5, 2017 ","Tech industry braces for Trump's visa reform - Feb. 5, 2017 ","Microsoft unveils a new (and hopefully not racist) chat bot - Dec. 13, 2016 ","Elon Musk says he's 'doing good' on Trump's advisory council - Feb. 4, 2017 ","I rented a guy's $145,000 Tesla Model X - Feb. 11, 2017 ","Twitter stock tanks 10% on disappointing sales - Feb. 9, 2017 ","How online resources are fueling the Trump resistance - Feb. 9, 2017 ","Your car's data may soon be more valuable than the car itself - Feb. 7, 2017 ",This is not your typical 'Make America Great Again' ad - CNNPolitics.com,Live coverage: President Trump's first week - CNNPolitics.com,GOP congressional leaders rule out torture - CNNPolitics.com,Trump's TPP withdrawal: 5 things to know - CNNPolitics.com,Donald Trump is doing exactly what he said - CNNPolitics.com,Melania Trump close to announcing core staff - CNNPolitics.com,Obama's advice to Theresa May: Befriend Donald Trump - CNNPolitics.com,Theresa May to visit Trump in Washington - CNN.com,Dallas school district investigating clip of staff shooting water gun at Trump picture - CNNPolitics.com,What Finland's plan to be tobacco-free can teach the world - CNN.com,State Department officials asked to leave by Trump administration - CNNPolitics.com,Trump to move forward with voter fraud probe - CNNPolitics.com,Trump says he'll send in feds if Chicago doesn't fix 'carnage' - CNNPolitics.com,"Trump: 'Had we taken the oil, you wouldn't have ISIS' - CNNPolitics.com","Andrew Puzder in 2015 discussing Trump: GOP can't be 'bigoted, anti-woman, anti-immigrant party' - CNNPolitics.com",Trump's talk puts GOP in a jam - CNNPolitics.com,Doomsday Clock: Humanity is edging closer to its end  - CNN.com,Abortion laws around the globe - CNN.com,PLO on possible US Embassy move: Group will revoke Israel recognition - CNNPolitics.com,How Facebook actually isolates us  - CNN.com,Trump floats 20% tax on Mexican imports to pay for wall - CNNPolitics.com,Every order Trump has signed and what his actions mean - CNNPolitics.com,The 6 most scientifically valid methods to quit smoking - CNN.com,Women rush to get IUDs because of Trump - CNN.com,Oil and Gasoline Fast Facts - CNN.com,Becky Anderson on her heroes: Her fellow journalists - CNN.com,E-cigarettes: Where do we stand?  - CNN.com,Mexican president cancels meeting with Trump - CNNPolitics.com,"Donald Trump: Torture ""absolutely works"" -- but does it? - CNNPolitics.com",Man uses Facebook to find woman who saved his life - CNN.com,Putting the 'active' in activism: How to get kids to get involved  - CNN.com,A front-row seat to Trump's rise - CNNPolitics.com,Where Trump support and Obamacare use soar - CNN.com,Kids say the darndest things about being president  - CNN.com,Trump calls Chelsea Manning 'ungrateful TRAITOR' after Obama criticism - CNNPolitics.com,Dalai Lama's guide to the next four years - CNN.com,These twin baby girls have different skin colors  - CNN.com,Boxer battles for title as his father battles cancer - CNN.com,5 reasons why some Nebraskans hate Obamacare - CNN.com,Greece won't extradite 8 Turkish military officers - CNN.com,"You're more likely to catch flu after a cold snap, study says - CNN.com",Quitting smoking is the hardest resolution to keep - CNN.com,"World's largest Indoor vertical farm to produce greens without sun, soil or water - CNN.com",Cuba Fast Facts - CNN.com,15 of the world's happiest places - CNN.com,US surgeons remove rare facial tumor from Brazilian girl - CNN.com,"Article 50: UK's path to Brexit, explained - CNN.com",What life was like for a medieval leper - CNN.com,Gina Miller: Chief Brexit claimant hopes court ruling ends abuse - CNN.com,Britain's navy keeps eye on Russia's 'ship of shame' - CNN.com,"Washington state mumps outbreak: 278 cases, 5 counties - CNN.com",Brexit bill introduced to parliament - CNN.com,The week in politics,Breaking the cycle of pleasure and guilt - CNN.com,Trump tells Hill GOP: Meeting Mexican president 'fruitless' - CNNPolitics.com,China's lack of sex education is putting millions of young people at risk - CNN.com,El Chapo Fast Facts - CNN.com,"Awaiting transplant, mom lives 6 days without lungs - CNN.com",Wild supercows return to Europe  - CNN.com,'Automated dermatologist' detects skin cancer with expert accuracy - CNN.com,"Building Trump's wall: For Texans, it's complicated - CNNPolitics.com",Can burnt toast and roasted potatoes cause cancer? - CNN.com,11 everyday items you should stop using now ,Pakistan Fast Facts - CNN.com,Libya Fast Facts - CNN.com,The week in 29 photos,What 'Split' gets wrong about dissociative identity disorder - CNN.com,"Italy avalanche: Hotel search ends with 29 dead, 11 rescued - CNN.com",Lebanon Fast Facts - CNN.com,Cervical cancer death rates are much higher than thought - CNN.com,'Fast radio burst' tracked to a dwarf galaxy 3 billion light-years away - CNN.com,People we've lost in 2017,The week in 25 photos,Study: 30% of kids have two or more sugary drinks a day - CNN.com,South Sudan Fast Facts - CNN.com,Central African Republic Fast Facts - CNN.com
"FedEx's new service takes aim at Amazon - Feb. 7, 2017 ",1,0.513,0.503,0.501,0.471,0.464,0.451,0.451,0.422,0.42,0.42,0.417,0.409,0.402,0.4,0.389,0.382,0.376,0.374,0.366,0.356,0.346,0.307,0.307,0.158,0.154,0.149,0.142,0.129,0.129,0.121,0.12,0.12,0.115,0.114,0.112,0.109,0.109,0.105,0.103,0.102,0.096,0.095,0.094,0.093,0.092,0.091,0.088,0.087,0.086,0.086,0.086,0.085,0.082,0.081,0.08,0.08,0.08,0.078,0.074,0.072,0.071,0.07,0.07,0.07,0.07,0.069,0.068,0.068,0.067,0.066,0.066,0.066,0.065,0.065,0.064,0.064,0.062,0.061,0.061,0.061,0.061,0.059,0.059,0.056,0.055,0.054,0.053,0.052,0.049,0.048,0.047,0.046,0.041,0.037,0.032,0.03,0.026,0.02,0.01
Article Titles,"Inside the quirky world of Snapchat - Feb. 3, 2017 ","Netflix wants in on toy and licensed merchandise business - Feb. 8, 2017 ","Pinterest's new 'Lens' IDs objects and helps you buy them - Feb. 8, 2017 ",Jack Dorsey: 'We benefit from immigration' - Video - Tech,"Robot makes money off Trump's tweets and donates it to the ASPCA - Feb. 6, 2017 ",Crash dummies are getting 'supersized' to resemble obese drivers - Video - Tech,"Facebook doubles down on bereavement leave - Feb. 7, 2017 ","'We are entrepreneurs, professors, scientists, artists' - Jan. 29, 2017 ","Elon Musk hopes to bring Tesla to India 'this year' - Feb. 8, 2017 ","Twitter tries new measures in crackdown on harassment - Feb. 7, 2017 ","State politics are the next battleground -- and tracking them just got easier - Feb. 7, 2017 ","Sheryl Sandberg gives $1 million to Planned Parenthood - Feb. 1, 2017 ","Intel CEO touts $7 billion factory investment in Trump meeting - Feb. 8, 2017 ","Mikey Dickerson fixed Healthcare.gov. That was just the beginning - Jan. 17, 2017 ","Twitter stock tanks 10% on disappointing sales - Feb. 9, 2017 ","Microsoft unveils a new (and hopefully not racist) chat bot - Dec. 13, 2016 ","Elon Musk says he's 'doing good' on Trump's advisory council - Feb. 4, 2017 ","Ooniprobe app helps people track internet censorship - Feb. 8, 2017 ","I rented a guy's $145,000 Tesla Model X - Feb. 11, 2017 ","Tech industry braces for Trump's visa reform - Feb. 5, 2017 ","FedEx's new service takes aim at Amazon - Feb. 7, 2017 ","More than 100 companies join legal fight against Trump travel ban - Feb. 5, 2017 ","How online resources are fueling the Trump resistance - Feb. 9, 2017 ","Your car's data may soon be more valuable than the car itself - Feb. 7, 2017 ",Live coverage: President Trump's first week - CNNPolitics.com,Theresa May to visit Trump in Washington - CNN.com,GOP congressional leaders rule out torture - CNNPolitics.com,Obama's advice to Theresa May: Befriend Donald Trump - CNNPolitics.com,This is not your typical 'Make America Great Again' ad - CNNPolitics.com,Melania Trump close to announcing core staff - CNNPolitics.com,Donald Trump is doing exactly what he said - CNNPolitics.com,Quitting smoking is the hardest resolution to keep - CNN.com,"World's largest Indoor vertical farm to produce greens without sun, soil or water - CNN.com",Putting the 'active' in activism: How to get kids to get involved  - CNN.com,Women rush to get IUDs because of Trump - CNN.com,What Finland's plan to be tobacco-free can teach the world - CNN.com,Dallas school district investigating clip of staff shooting water gun at Trump picture - CNNPolitics.com,Where Trump support and Obamacare use soar - CNN.com,State Department officials asked to leave by Trump administration - CNNPolitics.com,Trump says he'll send in feds if Chicago doesn't fix 'carnage' - CNNPolitics.com,Abortion laws around the globe - CNN.com,Trump's talk puts GOP in a jam - CNNPolitics.com,"You're more likely to catch flu after a cold snap, study says - CNN.com","Trump: 'Had we taken the oil, you wouldn't have ISIS' - CNNPolitics.com",5 reasons why some Nebraskans hate Obamacare - CNN.com,Doomsday Clock: Humanity is edging closer to its end  - CNN.com,Trump to move forward with voter fraud probe - CNNPolitics.com,Man uses Facebook to find woman who saved his life - CNN.com,China's lack of sex education is putting millions of young people at risk - CNN.com,15 of the world's happiest places - CNN.com,Trump floats 20% tax on Mexican imports to pay for wall - CNNPolitics.com,"Article 50: UK's path to Brexit, explained - CNN.com",Trump's TPP withdrawal: 5 things to know - CNNPolitics.com,Every order Trump has signed and what his actions mean - CNNPolitics.com,How Facebook actually isolates us  - CNN.com,"Andrew Puzder in 2015 discussing Trump: GOP can't be 'bigoted, anti-woman, anti-immigrant party' - CNNPolitics.com",Mexican president cancels meeting with Trump - CNNPolitics.com,Becky Anderson on her heroes: Her fellow journalists - CNN.com,Dalai Lama's guide to the next four years - CNN.com,PLO on possible US Embassy move: Group will revoke Israel recognition - CNNPolitics.com,"Awaiting transplant, mom lives 6 days without lungs - CNN.com",Greece won't extradite 8 Turkish military officers - CNN.com,Gina Miller: Chief Brexit claimant hopes court ruling ends abuse - CNN.com,Brexit bill introduced to parliament - CNN.com,Kids say the darndest things about being president  - CNN.com,"Washington state mumps outbreak: 278 cases, 5 counties - CNN.com",What 'Split' gets wrong about dissociative identity disorder - CNN.com,Breaking the cycle of pleasure and guilt - CNN.com,"Donald Trump: Torture ""absolutely works"" -- but does it? - CNNPolitics.com",A front-row seat to Trump's rise - CNNPolitics.com,US surgeons remove rare facial tumor from Brazilian girl - CNN.com,'Automated dermatologist' detects skin cancer with expert accuracy - CNN.com,Boxer battles for title as his father battles cancer - CNN.com,Can burnt toast and roasted potatoes cause cancer? - CNN.com,El Chapo Fast Facts - CNN.com,What life was like for a medieval leper - CNN.com,Oil and Gasoline Fast Facts - CNN.com,Trump calls Chelsea Manning 'ungrateful TRAITOR' after Obama criticism - CNNPolitics.com,Cervical cancer death rates are much higher than thought - CNN.com,These twin baby girls have different skin colors  - CNN.com,The 6 most scientifically valid methods to quit smoking - CNN.com,Libya Fast Facts - CNN.com,"Building Trump's wall: For Texans, it's complicated - CNNPolitics.com",Britain's navy keeps eye on Russia's 'ship of shame' - CNN.com,Cuba Fast Facts - CNN.com,The week in politics,People we've lost in 2017,Pakistan Fast Facts - CNN.com,Lebanon Fast Facts - CNN.com,E-cigarettes: Where do we stand?  - CNN.com,11 everyday items you should stop using now ,Wild supercows return to Europe  - CNN.com,Trump tells Hill GOP: Meeting Mexican president 'fruitless' - CNNPolitics.com,"Italy avalanche: Hotel search ends with 29 dead, 11 rescued - CNN.com",'Fast radio burst' tracked to a dwarf galaxy 3 billion light-years away - CNN.com,The week in 29 photos,Study: 30% of kids have two or more sugary drinks a day - CNN.com,The week in 25 photos,South Sudan Fast Facts - CNN.com,Central African Republic Fast Facts - CNN.com
"Inside the quirky world of Snapchat - Feb. 3, 2017 ",1,0.577,0.562,0.554,0.544,0.544,0.543,0.536,0.525,0.493,0.481,0.477,0.474,0.462,0.457,0.448,0.44,0.436,0.433,0.423,0.422,0.397,0.382,0.365,0.179,0.175,0.171,0.17,0.17,0.164,0.158,0.155,0.154,0.153,0.153,0.152,0.15,0.146,0.146,0.145,0.144,0.14,0.14,0.139,0.138,0.138,0.138,0.136,0.134,0.134,0.132,0.131,0.13,0.129,0.129,0.129,0.128,0.124,0.123,0.119,0.118,0.117,0.117,0.116,0.116,0.112,0.11,0.109,0.108,0.108,0.108,0.104,0.097,0.096,0.096,0.095,0.094,0.091,0.085,0.085,0.082,0.08,0.077,0.076,0.075,0.075,0.075,0.074,0.073,0.071,0.069,0.067,0.067,0.064,0.06,0.058,0.05,0.045,0.027,0.017
Article Titles,"Elon Musk says he's 'doing good' on Trump's advisory council - Feb. 4, 2017 ","More than 100 companies join legal fight against Trump travel ban - Feb. 5, 2017 ","Robot makes money off Trump's tweets and donates it to the ASPCA - Feb. 6, 2017 ","Elon Musk hopes to bring Tesla to India 'this year' - Feb. 8, 2017 ","Intel CEO touts $7 billion factory investment in Trump meeting - Feb. 8, 2017 ","'We are entrepreneurs, professors, scientists, artists' - Jan. 29, 2017 ","Netflix wants in on toy and licensed merchandise business - Feb. 8, 2017 ","Facebook doubles down on bereavement leave - Feb. 7, 2017 ",Jack Dorsey: 'We benefit from immigration' - Video - Tech,"How online resources are fueling the Trump resistance - Feb. 9, 2017 ","State politics are the next battleground -- and tracking them just got easier - Feb. 7, 2017 ",Crash dummies are getting 'supersized' to resemble obese drivers - Video - Tech,"Sheryl Sandberg gives $1 million to Planned Parenthood - Feb. 1, 2017 ","Twitter stock tanks 10% on disappointing sales - Feb. 9, 2017 ","Tech industry braces for Trump's visa reform - Feb. 5, 2017 ","Inside the quirky world of Snapchat - Feb. 3, 2017 ","Pinterest's new 'Lens' IDs objects and helps you buy them - Feb. 8, 2017 ","Twitter tries new measures in crackdown on harassment - Feb. 7, 2017 ","Mikey Dickerson fixed Healthcare.gov. That was just the beginning - Jan. 17, 2017 ","Ooniprobe app helps people track internet censorship - Feb. 8, 2017 ","FedEx's new service takes aim at Amazon - Feb. 7, 2017 ","Microsoft unveils a new (and hopefully not racist) chat bot - Dec. 13, 2016 ","I rented a guy's $145,000 Tesla Model X - Feb. 11, 2017 ",Donald Trump is doing exactly what he said - CNNPolitics.com,Live coverage: President Trump's first week - CNNPolitics.com,Trump's talk puts GOP in a jam - CNNPolitics.com,Every order Trump has signed and what his actions mean - CNNPolitics.com,"Your car's data may soon be more valuable than the car itself - Feb. 7, 2017 ",Trump to move forward with voter fraud probe - CNNPolitics.com,Obama's advice to Theresa May: Befriend Donald Trump - CNNPolitics.com,Theresa May to visit Trump in Washington - CNN.com,Trump's TPP withdrawal: 5 things to know - CNNPolitics.com,"Andrew Puzder in 2015 discussing Trump: GOP can't be 'bigoted, anti-woman, anti-immigrant party' - CNNPolitics.com",Mexican president cancels meeting with Trump - CNNPolitics.com,Trump tells Hill GOP: Meeting Mexican president 'fruitless' - CNNPolitics.com,Women rush to get IUDs because of Trump - CNN.com,A front-row seat to Trump's rise - CNNPolitics.com,Melania Trump close to announcing core staff - CNNPolitics.com,"Donald Trump: Torture ""absolutely works"" -- but does it? - CNNPolitics.com","Trump: 'Had we taken the oil, you wouldn't have ISIS' - CNNPolitics.com",Trump says he'll send in feds if Chicago doesn't fix 'carnage' - CNNPolitics.com,Trump floats 20% tax on Mexican imports to pay for wall - CNNPolitics.com,GOP congressional leaders rule out torture - CNNPolitics.com,Dallas school district investigating clip of staff shooting water gun at Trump picture - CNNPolitics.com,This is not your typical 'Make America Great Again' ad - CNNPolitics.com,State Department officials asked to leave by Trump administration - CNNPolitics.com,Putting the 'active' in activism: How to get kids to get involved  - CNN.com,Doomsday Clock: Humanity is edging closer to its end  - CNN.com,The week in politics,Kids say the darndest things about being president  - CNN.com,Trump calls Chelsea Manning 'ungrateful TRAITOR' after Obama criticism - CNNPolitics.com,Where Trump support and Obamacare use soar - CNN.com,Abortion laws around the globe - CNN.com,Dalai Lama's guide to the next four years - CNN.com,"Building Trump's wall: For Texans, it's complicated - CNNPolitics.com",PLO on possible US Embassy move: Group will revoke Israel recognition - CNNPolitics.com,"Awaiting transplant, mom lives 6 days without lungs - CNN.com",What Finland's plan to be tobacco-free can teach the world - CNN.com,Quitting smoking is the hardest resolution to keep - CNN.com,5 reasons why some Nebraskans hate Obamacare - CNN.com,Man uses Facebook to find woman who saved his life - CNN.com,China's lack of sex education is putting millions of young people at risk - CNN.com,What 'Split' gets wrong about dissociative identity disorder - CNN.com,Greece won't extradite 8 Turkish military officers - CNN.com,"Washington state mumps outbreak: 278 cases, 5 counties - CNN.com",The week in 29 photos,Becky Anderson on her heroes: Her fellow journalists - CNN.com,Brexit bill introduced to parliament - CNN.com,Breaking the cycle of pleasure and guilt - CNN.com,US surgeons remove rare facial tumor from Brazilian girl - CNN.com,Gina Miller: Chief Brexit claimant hopes court ruling ends abuse - CNN.com,'Automated dermatologist' detects skin cancer with expert accuracy - CNN.com,Boxer battles for title as his father battles cancer - CNN.com,"Article 50: UK's path to Brexit, explained - CNN.com",How Facebook actually isolates us  - CNN.com,"You're more likely to catch flu after a cold snap, study says - CNN.com",Can burnt toast and roasted potatoes cause cancer? - CNN.com,The 6 most scientifically valid methods to quit smoking - CNN.com,Libya Fast Facts - CNN.com,15 of the world's happiest places - CNN.com,What life was like for a medieval leper - CNN.com,Oil and Gasoline Fast Facts - CNN.com,Cuba Fast Facts - CNN.com,"World's largest Indoor vertical farm to produce greens without sun, soil or water - CNN.com",The week in 25 photos,These twin baby girls have different skin colors  - CNN.com,Wild supercows return to Europe  - CNN.com,Britain's navy keeps eye on Russia's 'ship of shame' - CNN.com,El Chapo Fast Facts - CNN.com,Lebanon Fast Facts - CNN.com,Cervical cancer death rates are much higher than thought - CNN.com,Pakistan Fast Facts - CNN.com,E-cigarettes: Where do we stand?  - CNN.com,'Fast radio burst' tracked to a dwarf galaxy 3 billion light-years away - CNN.com,Study: 30% of kids have two or more sugary drinks a day - CNN.com,"Italy avalanche: Hotel search ends with 29 dead, 11 rescued - CNN.com",11 everyday items you should stop using now ,People we've lost in 2017,South Sudan Fast Facts - CNN.com,Central African Republic Fast Facts - CNN.com
"Elon Musk says he's 'doing good' on Trump's advisory council - Feb. 4, 2017 ",1,0.58,0.576,0.563,0.54,0.522,0.5,0.496,0.495,0.473,0.467,0.466,0.462,0.459,0.453,0.44,0.437,0.426,0.416,0.376,0.366,0.364,0.356,0.35,0.35,0.347,0.318,0.304,0.294,0.29,0.283,0.283,0.283,0.281,0.266,0.251,0.243,0.242,0.235,0.232,0.219,0.218,0.218,0.218,0.188,0.187,0.18,0.171,0.168,0.166,0.159,0.158,0.149,0.137,0.135,0.127,0.124,0.121,0.119,0.115,0.107,0.106,0.104,0.101,0.097,0.096,0.096,0.095,0.091,0.091,0.091,0.09,0.089,0.088,0.088,0.087,0.082,0.082,0.08,0.078,0.077,0.073,0.072,0.07,0.069,0.065,0.064,0.064,0.061,0.058,0.057,0.055,0.048,0.046,0.046,0.044,0.044,0.038,0.026,0.019
