Article Titles,"Tech industry braces for Trump's visa reform - Feb. 5, 2017 ","More than 100 companies join legal fight against Trump travel ban - Feb. 5, 2017 ","Intel CEO touts $7 billion factory investment in Trump meeting - Feb. 8, 2017 ",Jack Dorsey: 'We benefit from immigration' - Video - Tech,"We are entrepreneurs, professors, scientists, artists' - Jan. 29, 2017 ","Facebook doubles down on bereavement leave - Feb. 7, 2017 ",Crash dummies are getting 'supersized' to resemble obese drivers - Video - Tech,"Netflix wants in on toy and licensed merchandise business - Feb. 8, 2017 ","Robot makes money off Trump's tweets and donates it to the ASPCA - Feb. 6, 2017 ","State politics are the next battleground -- and tracking them just got easier - Feb. 7, 2017 ","Elon Musk says he's 'doing good' on Trump's advisory council - Feb. 4, 2017 ","Pinterest's new 'Lens' IDs objects and helps you buy them - Feb. 8, 2017 ","Sheryl Sandberg gives $1 million to Planned Parenthood - Feb. 1, 2017 ","Elon Musk hopes to bring Tesla to India 'this year' - Feb. 8, 2017 ","Mikey Dickerson fixed Healthcare.gov. That was just the beginning - Jan. 17, 2017 ","Inside the quirky world of Snapchat - Feb. 3, 2017 ","Twitter stock tanks 10% on disappointing sales - Feb. 9, 2017 ","Twitter tries new measures in crackdown on harassment - Feb. 7, 2017 ","How online resources are fueling the Trump resistance - Feb. 9, 2017 ","Ooniprobe app helps people track internet censorship - Feb. 8, 2017 ","FedEx's new service takes aim at Amazon - Feb. 7, 2017 ","Microsoft unveils a new (and hopefully not racist) chat bot - Dec. 13, 2016 ","I rented a guy's $145,000 Tesla Model X - Feb. 11, 2017 ","Your car's data may soon be more valuable than the car itself - Feb. 7, 2017 ",Every order Trump has signed and what his actions mean - CNNPolitics.com,Donald Trump is doing exactly what he said - CNNPolitics.com,Trump's talk puts GOP in a jam - CNNPolitics.com,Live coverage: President Trump's first week - CNNPolitics.com,Trump to move forward with voter fraud probe - CNNPolitics.com,Trump's TPP withdrawal: 5 things to know - CNNPolitics.com,Mexican president cancels meeting with Trump - CNNPolitics.com,"Andrew Puzder in 2015 discussing Trump: GOP can't be 'bigoted, anti-woman, anti-immigrant party' - CNNPolitics.com",Theresa May to visit Trump in Washington - CNN.com,Melania Trump close to announcing core staff - CNNPolitics.com,Obama's advice to Theresa May: Befriend Donald Trump - CNNPolitics.com,State Department officials asked to leave by Trump administration - CNNPolitics.com,Women rush to get IUDs because of Trump - CNN.com,"Donald Trump: Torture ""absolutely works"" -- but does it? - CNNPolitics.com",Trump floats 20% tax on Mexican imports to pay for wall - CNNPolitics.com,GOP congressional leaders rule out torture - CNNPolitics.com,Dallas school district investigating clip of staff shooting water gun at Trump picture - CNNPolitics.com,This is not your typical 'Make America Great Again' ad - CNNPolitics.com,Where Trump support and Obamacare use soar - CNN.com,Trump says he'll send in feds if Chicago doesn't fix 'carnage' - CNNPolitics.com,A front-row seat to Trump's rise - CNNPolitics.com,"Trump: 'Had we taken the oil, you wouldn't have ISIS' - CNNPolitics.com",Putting the 'active' in activism: How to get kids to get involved  - CNN.com,Trump tells Hill GOP: Meeting Mexican president 'fruitless' - CNNPolitics.com,Doomsday Clock: Humanity is edging closer to its end  - CNN.com,Kids say the darndest things about being president  - CNN.com,Abortion laws around the globe - CNN.com,What Finland's plan to be tobacco-free can teach the world - CNN.com,5 reasons why some Nebraskans hate Obamacare - CNN.com,PLO on possible US Embassy move: Group will revoke Israel recognition - CNNPolitics.com,Dalai Lama's guide to the next four years - CNN.com,"Awaiting transplant, mom lives 6 days without lungs - CNN.com",Trump calls Chelsea Manning 'ungrateful TRAITOR' after Obama criticism - CNNPolitics.com,Quitting smoking is the hardest resolution to keep - CNN.com,"Washington state mumps outbreak: 278 cases, 5 counties - CNN.com",The week in politics,Greece won't extradite 8 Turkish military officers - CNN.com,Gina Miller: Chief Brexit claimant hopes court ruling ends abuse - CNN.com,"Building Trump's wall: For Texans, it's complicated - CNNPolitics.com",Man uses Facebook to find woman who saved his life - CNN.com,China's lack of sex education is putting millions of young people at risk - CNN.com,'Automated dermatologist' detects skin cancer with expert accuracy - CNN.com,15 of the world's happiest places - CNN.com,"Article 50: UK's path to Brexit, explained - CNN.com",Becky Anderson on her heroes: Her fellow journalists - CNN.com,"World's largest Indoor vertical farm to produce greens without sun, soil or water - CNN.com",The 6 most scientifically valid methods to quit smoking - CNN.com,What life was like for a medieval leper - CNN.com,What 'Split' gets wrong about dissociative identity disorder - CNN.com,Brexit bill introduced to parliament - CNN.com,US surgeons remove rare facial tumor from Brazilian girl - CNN.com,Breaking the cycle of pleasure and guilt - CNN.com,How Facebook actually isolates us  - CNN.com,"You're more likely to catch flu after a cold snap, study says - CNN.com",Oil and Gasoline Fast Facts - CNN.com,Wild supercows return to Europe  - CNN.com,Cuba Fast Facts - CNN.com,Boxer battles for title as his father battles cancer - CNN.com,Libya Fast Facts - CNN.com,Can burnt toast and roasted potatoes cause cancer? - CNN.com,Cervical cancer death rates are much higher than thought - CNN.com,The week in 29 photos,E-cigarettes: Where do we stand?  - CNN.com,El Chapo Fast Facts - CNN.com,These twin baby girls have different skin colors  - CNN.com,Britain's navy keeps eye on Russia's 'ship of shame' - CNN.com,'Fast radio burst' tracked to a dwarf galaxy 3 billion light-years away - CNN.com,11 everyday items you should stop using now ,Lebanon Fast Facts - CNN.com,The week in 25 photos,"Italy avalanche: Hotel search ends with 29 dead, 11 rescued - CNN.com",Study: 30% of kids have two or more sugary drinks a day - CNN.com,Pakistan Fast Facts - CNN.com,People we've lost in 2017,South Sudan Fast Facts - CNN.com,Central African Republic Fast Facts - CNN.com
"Tech industry braces for Trump's visa reform - Feb. 5, 2017 ",1,0.571,0.527,0.521,0.505,0.505,0.489,0.483,0.477,0.456,0.453,0.451,0.434,0.432,0.43,0.423,0.42,0.417,0.406,0.391,0.376,0.374,0.355,0.318,0.278,0.257,0.235,0.229,0.222,0.22,0.202,0.196,0.192,0.192,0.19,0.188,0.179,0.177,0.176,0.17,0.17,0.163,0.157,0.154,0.154,0.154,0.146,0.145,0.14,0.135,0.134,0.133,0.13,0.123,0.118,0.118,0.116,0.116,0.115,0.112,0.112,0.111,0.11,0.109,0.108,0.106,0.103,0.101,0.101,0.101,0.101,0.099,0.098,0.097,0.097,0.096,0.091,0.087,0.086,0.085,0.084,0.078,0.077,0.077,0.075,0.075,0.075,0.074,0.07,0.064,0.062,0.062,0.062,0.059,0.057,0.053,0.052,0.05,0.024,0.015
Article Titles,"Intel CEO touts $7 billion factory investment in Trump meeting - Feb. 8, 2017 ","Robot makes money off Trump's tweets and donates it to the ASPCA - Feb. 6, 2017 ","More than 100 companies join legal fight against Trump travel ban - Feb. 5, 2017 ",Jack Dorsey: 'We benefit from immigration' - Video - Tech,"'We are entrepreneurs, professors, scientists, artists' - Jan. 29, 2017 ","Facebook doubles down on bereavement leave - Feb. 7, 2017 ","Elon Musk says he's 'doing good' on Trump's advisory council - Feb. 4, 2017 ","Netflix wants in on toy and licensed merchandise business - Feb. 8, 2017 ",Crash dummies are getting 'supersized' to resemble obese drivers - Video - Tech,"Tech industry braces for Trump's visa reform - Feb. 5, 2017 ","Pinterest's new 'Lens' IDs objects and helps you buy them - Feb. 8, 2017 ","Sheryl Sandberg gives $1 million to Planned Parenthood - Feb. 1, 2017 ","State politics are the next battleground -- and tracking them just got easier - Feb. 7, 2017 ","How online resources are fueling the Trump resistance - Feb. 9, 2017 ","Inside the quirky world of Snapchat - Feb. 3, 2017 ","Elon Musk hopes to bring Tesla to India 'this year' - Feb. 8, 2017 ","Twitter stock tanks 10% on disappointing sales - Feb. 9, 2017 ","Twitter tries new measures in crackdown on harassment - Feb. 7, 2017 ","Mikey Dickerson fixed Healthcare.gov. That was just the beginning - Jan. 17, 2017 ","FedEx's new service takes aim at Amazon - Feb. 7, 2017 ","Ooniprobe app helps people track internet censorship - Feb. 8, 2017 ","Microsoft unveils a new (and hopefully not racist) chat bot - Dec. 13, 2016 ","I rented a guy's $145,000 Tesla Model X - Feb. 11, 2017 ",Donald Trump is doing exactly what he said - CNNPolitics.com,Live coverage: President Trump's first week - CNNPolitics.com,"Your car's data may soon be more valuable than the car itself - Feb. 7, 2017 ",Trump's talk puts GOP in a jam - CNNPolitics.com,Every order Trump has signed and what his actions mean - CNNPolitics.com,Trump to move forward with voter fraud probe - CNNPolitics.com,Obama's advice to Theresa May: Befriend Donald Trump - CNNPolitics.com,Trump's TPP withdrawal: 5 things to know - CNNPolitics.com,Mexican president cancels meeting with Trump - CNNPolitics.com,"Andrew Puzder in 2015 discussing Trump: GOP can't be 'bigoted, anti-woman, anti-immigrant party' - CNNPolitics.com",Theresa May to visit Trump in Washington - CNN.com,Trump tells Hill GOP: Meeting Mexican president 'fruitless' - CNNPolitics.com,Melania Trump close to announcing core staff - CNNPolitics.com,A front-row seat to Trump's rise - CNNPolitics.com,"Donald Trump: Torture ""absolutely works"" -- but does it? - CNNPolitics.com",GOP congressional leaders rule out torture - CNNPolitics.com,Trump floats 20% tax on Mexican imports to pay for wall - CNNPolitics.com,"Trump: 'Had we taken the oil, you wouldn't have ISIS' - CNNPolitics.com",Dallas school district investigating clip of staff shooting water gun at Trump picture - CNNPolitics.com,This is not your typical 'Make America Great Again' ad - CNNPolitics.com,State Department officials asked to leave by Trump administration - CNNPolitics.com,Women rush to get IUDs because of Trump - CNN.com,Trump says he'll send in feds if Chicago doesn't fix 'carnage' - CNNPolitics.com,Trump calls Chelsea Manning 'ungrateful TRAITOR' after Obama criticism - CNNPolitics.com,Abortion laws around the globe - CNN.com,Doomsday Clock: Humanity is edging closer to its end  - CNN.com,The week in politics,Putting the 'active' in activism: How to get kids to get involved  - CNN.com,Where Trump support and Obamacare use soar - CNN.com,PLO on possible US Embassy move: Group will revoke Israel recognition - CNNPolitics.com,Kids say the darndest things about being president  - CNN.com,"Building Trump's wall: For Texans, it's complicated - CNNPolitics.com",Gina Miller: Chief Brexit claimant hopes court ruling ends abuse - CNN.com,Dalai Lama's guide to the next four years - CNN.com,Oil and Gasoline Fast Facts - CNN.com,What Finland's plan to be tobacco-free can teach the world - CNN.com,Becky Anderson on her heroes: Her fellow journalists - CNN.com,5 reasons why some Nebraskans hate Obamacare - CNN.com,Man uses Facebook to find woman who saved his life - CNN.com,China's lack of sex education is putting millions of young people at risk - CNN.com,"Awaiting transplant, mom lives 6 days without lungs - CNN.com",Greece won't extradite 8 Turkish military officers - CNN.com,Quitting smoking is the hardest resolution to keep - CNN.com,The week in 29 photos,How Facebook actually isolates us  - CNN.com,What 'Split' gets wrong about dissociative identity disorder - CNN.com,'Automated dermatologist' detects skin cancer with expert accuracy - CNN.com,Brexit bill introduced to parliament - CNN.com,US surgeons remove rare facial tumor from Brazilian girl - CNN.com,"World's largest Indoor vertical farm to produce greens without sun, soil or water - CNN.com","Washington state mumps outbreak: 278 cases, 5 counties - CNN.com",Cuba Fast Facts - CNN.com,"Article 50: UK's path to Brexit, explained - CNN.com",What life was like for a medieval leper - CNN.com,The week in 25 photos,15 of the world's happiest places - CNN.com,Boxer battles for title as his father battles cancer - CNN.com,Breaking the cycle of pleasure and guilt - CNN.com,Can burnt toast and roasted potatoes cause cancer? - CNN.com,These twin baby girls have different skin colors  - CNN.com,"You're more likely to catch flu after a cold snap, study says - CNN.com",Pakistan Fast Facts - CNN.com,Lebanon Fast Facts - CNN.com,Libya Fast Facts - CNN.com,Britain's navy keeps eye on Russia's 'ship of shame' - CNN.com,El Chapo Fast Facts - CNN.com,The 6 most scientifically valid methods to quit smoking - CNN.com,Wild supercows return to Europe  - CNN.com,Cervical cancer death rates are much higher than thought - CNN.com,11 everyday items you should stop using now ,People we've lost in 2017,"Italy avalanche: Hotel search ends with 29 dead, 11 rescued - CNN.com",E-cigarettes: Where do we stand?  - CNN.com,'Fast radio burst' tracked to a dwarf galaxy 3 billion light-years away - CNN.com,Study: 30% of kids have two or more sugary drinks a day - CNN.com,South Sudan Fast Facts - CNN.com,Central African Republic Fast Facts - CNN.com
"Intel CEO touts $7 billion factory investment in Trump meeting - Feb. 8, 2017 ",1,0.607,0.591,0.575,0.544,0.542,0.54,0.53,0.528,0.527,0.505,0.496,0.488,0.475,0.474,0.472,0.471,0.439,0.432,0.42,0.411,0.404,0.371,0.342,0.336,0.332,0.326,0.309,0.304,0.295,0.288,0.286,0.281,0.271,0.257,0.247,0.24,0.232,0.225,0.219,0.216,0.21,0.209,0.201,0.195,0.191,0.176,0.171,0.157,0.152,0.143,0.141,0.135,0.134,0.129,0.119,0.116,0.115,0.113,0.113,0.107,0.107,0.103,0.103,0.101,0.099,0.096,0.093,0.092,0.091,0.089,0.088,0.085,0.085,0.082,0.081,0.08,0.079,0.078,0.077,0.075,0.075,0.075,0.075,0.074,0.073,0.071,0.07,0.068,0.067,0.065,0.059,0.056,0.053,0.05,0.048,0.047,0.037,0.031,0.023
Article Titles,Libya Fast Facts - CNN.com,Lebanon Fast Facts - CNN.com,Pakistan Fast Facts - CNN.com,Oil and Gasoline Fast Facts - CNN.com,Cuba Fast Facts - CNN.com,Brexit bill introduced to parliament - CNN.com,Theresa May to visit Trump in Washington - CNN.com,"Article 50: UK's path to Brexit, explained - CNN.com",Abortion laws around the globe - CNN.com,Gina Miller: Chief Brexit claimant hopes court ruling ends abuse - CNN.com,Becky Anderson on her heroes: Her fellow journalists - CNN.com,Greece won't extradite 8 Turkish military officers - CNN.com,Doomsday Clock: Humanity is edging closer to its end  - CNN.com,El Chapo Fast Facts - CNN.com,How Facebook actually isolates us  - CNN.com,Man uses Facebook to find woman who saved his life - CNN.com,Every order Trump has signed and what his actions mean - CNNPolitics.com,Britain's navy keeps eye on Russia's 'ship of shame' - CNN.com,US surgeons remove rare facial tumor from Brazilian girl - CNN.com,Quitting smoking is the hardest resolution to keep - CNN.com,Putting the 'active' in activism: How to get kids to get involved  - CNN.com,Women rush to get IUDs because of Trump - CNN.com,"You're more likely to catch flu after a cold snap, study says - CNN.com",These twin baby girls have different skin colors  - CNN.com,Obama's advice to Theresa May: Befriend Donald Trump - CNNPolitics.com,People we've lost in 2017,Boxer battles for title as his father battles cancer - CNN.com,Donald Trump is doing exactly what he said - CNNPolitics.com,Dalai Lama's guide to the next four years - CNN.com,"Washington state mumps outbreak: 278 cases, 5 counties - CNN.com",The week in 29 photos,Trump's TPP withdrawal: 5 things to know - CNNPolitics.com,5 reasons why some Nebraskans hate Obamacare - CNN.com,PLO on possible US Embassy move: Group will revoke Israel recognition - CNNPolitics.com,GOP congressional leaders rule out torture - CNNPolitics.com,South Sudan Fast Facts - CNN.com,What Finland's plan to be tobacco-free can teach the world - CNN.com,Where Trump support and Obamacare use soar - CNN.com,"Trump: 'Had we taken the oil, you wouldn't have ISIS' - CNNPolitics.com",15 of the world's happiest places - CNN.com,This is not your typical 'Make America Great Again' ad - CNNPolitics.com,China's lack of sex education is putting millions of young people at risk - CNN.com,The week in 25 photos,What life was like for a medieval leper - CNN.com,Melania Trump close to announcing core staff - CNNPolitics.com,State Department officials asked to leave by Trump administration - CNNPolitics.com,"How online resources are fueling the Trump resistance - Feb. 9, 2017 ","Awaiting transplant, mom lives 6 days without lungs - CNN.com",Live coverage: President Trump's first week - CNNPolitics.com,Kids say the darndest things about being president  - CNN.com,"Donald Trump: Torture ""absolutely works"" -- but does it? - CNNPolitics.com","Italy avalanche: Hotel search ends with 29 dead, 11 rescued - CNN.com",The 6 most scientifically valid methods to quit smoking - CNN.com,What 'Split' gets wrong about dissociative identity disorder - CNN.com,Cervical cancer death rates are much higher than thought - CNN.com,11 everyday items you should stop using now ,'Automated dermatologist' detects skin cancer with expert accuracy - CNN.com,Trump to move forward with voter fraud probe - CNNPolitics.com,"Mikey Dickerson fixed Healthcare.gov. That was just the beginning - Jan. 17, 2017 ",Trump's talk puts GOP in a jam - CNNPolitics.com,Dallas school district investigating clip of staff shooting water gun at Trump picture - CNNPolitics.com,A front-row seat to Trump's rise - CNNPolitics.com,"World's largest Indoor vertical farm to produce greens without sun, soil or water - CNN.com","More than 100 companies join legal fight against Trump travel ban - Feb. 5, 2017 ",Can burnt toast and roasted potatoes cause cancer? - CNN.com,"Building Trump's wall: For Texans, it's complicated - CNNPolitics.com",Breaking the cycle of pleasure and guilt - CNN.com,"Andrew Puzder in 2015 discussing Trump: GOP can't be 'bigoted, anti-woman, anti-immigrant party' - CNNPolitics.com","'We are entrepreneurs, professors, scientists, artists' - Jan. 29, 2017 ",Central African Republic Fast Facts - CNN.com,Wild supercows return to Europe  - CNN.com,"State politics are the next battleground -- and tracking them just got easier - Feb. 7, 2017 ",The week in politics,Trump says he'll send in feds if Chicago doesn't fix 'carnage' - CNNPolitics.com,Mexican president cancels meeting with Trump - CNNPolitics.com,Trump calls Chelsea Manning 'ungrateful TRAITOR' after Obama criticism - CNNPolitics.com,"Inside the quirky world of Snapchat - Feb. 3, 2017 ","Elon Musk says he's 'doing good' on Trump's advisory council - Feb. 4, 2017 ","Tech industry braces for Trump's visa reform - Feb. 5, 2017 ",Trump floats 20% tax on Mexican imports to pay for wall - CNNPolitics.com,"Intel CEO touts $7 billion factory investment in Trump meeting - Feb. 8, 2017 ","Facebook doubles down on bereavement leave - Feb. 7, 2017 ",'Fast radio burst' tracked to a dwarf galaxy 3 billion light-years away - CNN.com,"Ooniprobe app helps people track internet censorship - Feb. 8, 2017 ","Pinterest's new 'Lens' IDs objects and helps you buy them - Feb. 8, 2017 ",E-cigarettes: Where do we stand?  - CNN.com,"Elon Musk hopes to bring Tesla to India 'this year' - Feb. 8, 2017 ","Sheryl Sandberg gives $1 million to Planned Parenthood - Feb. 1, 2017 ","Twitter stock tanks 10% on disappointing sales - Feb. 9, 2017 ","I rented a guy's $145,000 Tesla Model X - Feb. 11, 2017 ","Robot makes money off Trump's tweets and donates it to the ASPCA - Feb. 6, 2017 ","Twitter tries new measures in crackdown on harassment - Feb. 7, 2017 ",Study: 30% of kids have two or more sugary drinks a day - CNN.com,"Netflix wants in on toy and licensed merchandise business - Feb. 8, 2017 ","FedEx's new service takes aim at Amazon - Feb. 7, 2017 ","Microsoft unveils a new (and hopefully not racist) chat bot - Dec. 13, 2016 ","Your car's data may soon be more valuable than the car itself - Feb. 7, 2017 ",Trump tells Hill GOP: Meeting Mexican president 'fruitless' - CNNPolitics.com,Jack Dorsey: 'We benefit from immigration' - Video - Tech,Crash dummies are getting 'supersized' to resemble obese drivers - Video - Tech
Libya Fast Facts - CNN.com,1,0.35,0.307,0.284,0.231,0.222,0.22,0.197,0.189,0.188,0.183,0.182,0.173,0.173,0.158,0.153,0.15,0.147,0.147,0.147,0.146,0.142,0.142,0.139,0.139,0.139,0.133,0.132,0.131,0.129,0.128,0.128,0.126,0.124,0.124,0.123,0.122,0.121,0.12,0.12,0.12,0.119,0.115,0.114,0.113,0.112,0.111,0.111,0.11,0.109,0.108,0.108,0.107,0.106,0.105,0.105,0.104,0.104,0.102,0.1,0.1,0.099,0.099,0.098,0.095,0.094,0.092,0.092,0.087,0.087,0.086,0.086,0.084,0.082,0.082,0.081,0.08,0.08,0.077,0.073,0.071,0.07,0.066,0.065,0.064,0.063,0.062,0.061,0.061,0.061,0.055,0.054,0.052,0.052,0.052,0.051,0.048,0.047,0.042,0.04
